toolname	version	license	license_link	officialname	short_description	differential	manual_link	publication_name	publication_link	note	warning	issues
asgal	1.1.6	GNU General Public License version 3	https://github.com/AlgoLab/galig/blob/master/LICENSE	ASGAL		no	https://asgal.algolab.eu/documentation	ASGAL: aligning RNA-Seq data to a splicing graph to detect novel alternative splicing events	https://bmcbioinformatics.biomedcentral.com/articles/10.1186/s12859-018-2436-3		|tool| requires the variables ``$fastqpair1suffix`` and ``$fastqpair2suffix`` to be set in the :guilabel:`scripts/asevent_config.sh` file.	
irfinder	1.3.1	MIT Licence	https://github.com/williamritchie/IRFinder/blob/master/LICENSE	IRFinder		no	https://github.com/williamritchie/IRFinder/wiki	IRFinder: assessing the impact of intron retention on mammalian gene expression	https://genomebiology.biomedcentral.com/articles/10.1186/s13059-017-1184-4	|tool| can use both fastq and bam files. To use bamfiles please set the parameter $use_bam_input_files=1, and =0 to use fastq files in the as_config.sh script.		
aspli	1.12.0	GNU General Public License version 3	https://github.com/AlgoLab/galig/blob/master/LICENSE	Aspli		both	https://bioconductor.org/packages/release/bioc/vignettes/ASpli/inst/doc/ASpli.pdf	ASpli: integrative analysis of splicing landscapes through RNA-Seq assays 	https://academic.oup.com/bioinformatics/advance-article/doi/10.1093/bioinformatics/btab141/6156815	|tool| is an R package. Therefore our ENTRYPOINT.sh script for |tool| calls an R script to run the tool. The parameters listed here are the parameters given to the R script.		
eventpointer	2.4.0	Artistic software License 2	https://opensource.org/licenses/Artistic-2.0	EventPointer		both	https://www.bioconductor.org/packages/release/bioc/vignettes/EventPointer/inst/doc/EventPointer.html	EventPointer: an effective identification of alternative splicing events using junction arrays	https://bmcgenomics.biomedcentral.com/articles/10.1186/s12864-016-2816-x	|tool| is an R package. Therefore our ENTRYPOINT.sh script for |tool| calls an R script to run the tool. The parameters listed here are the parameters given to the R script.		
majiq	2.3	Academic License	https://majiq.biociphers.org/Academic_License.txt	MAJIQ		both	https://majiq.biociphers.org/	A new view of transcriptome complexity and regulation through the lens of local splicing variations	https://elifesciences.org/articles/11752			
sgseq	1.24.0	Artistic software License 2	https://opensource.org/licenses/Artistic-2.0	SGSeq		no	https://bioconductor.org/packages/release/bioc/vignettes/SGSeq/inst/doc/SGSeq.html	Prediction and Quantification of Splice Events from RNA-Seq Data	https://journals.plos.org/plosone/article?id=10.1371/journal.pone.0156132	|tool| is an R package. Therefore our ENTRYPOINT.sh script for |tool| calls an R script to run the tool. The parameters listed here are the parameters given to the R script.		
spladder	2.4.3	BSD License	https://github.com/ratschlab/spladder/blob/master/COPYRIGHT	SplAdder		both	https://spladder.readthedocs.io/en/latest/	SplAdder: identification, quantification and testing of alternative splicing events from RNA-Seq data	https://pubmed.ncbi.nlm.nih.gov/26873928/			
whippet	0.11.1	MIT Licence	https://github.com/timbitz/Whippet.jl/blob/master/LICENSE	Whippet		both	https://github.com/timbitz/Whippet.jl	Efficient and Accurate Quantitative Profiling of Alternative Splicing Patterns of Any Complexity on a Laptop	https://pubmed.ncbi.nlm.nih.gov/30220560/			
